{
  "schema_version": 2,
  "measurement_ttl_seconds": {
    "compute": 300,
    "wake": 300,
    "provider_capacity": 3600
  },
  "route_registry": {
    "work_items": "docs/orchestration/control-plane/work-items.tsv",
    "source_inventory": "docs/orchestration/control-plane/source-record-inventory.tsv",
    "open_items": "docs/OPEN_ITEMS.md",
    "policy": "docs/orchestration/control-plane/policy.json"
  },
  "evidence_routes": [
    {
      "label": "Current work",
      "path": "docs/CURRENT_WORK.md"
    },
    {
      "label": "Governing open-item records",
      "path": "docs/OPEN_ITEMS.md"
    },
    {
      "label": "Validation ledger",
      "path": "VALIDATION_LEDGER.md"
    },
    {
      "label": "Run history",
      "path": "docs/orchestration/RUNS.tsv"
    },
    {
      "label": "Gate-6 prohibitions",
      "path": "docs/orchestration/state/gate6-member-trajectories-result-56847059.json",
      "json_field": "prohibitions_applied"
    }
  ],
  "jobs": [],
  "wake": {
    "waker": true
  }
}
